<?xml version="1.0" encoding="UTF-8"?>

<xs:schema xmlns:xs="http://www.w3.org/2001/XMLSchema" elementFormDefault="qualified">

	<xs:element name="config">
		<xs:complexType>
			<xs:sequence>
				<xs:element name="name" type="xs:string" />
				<xs:element name="api-version" type="xs:string" />
				<xs:element name="service-class" type="xs:string" />
				<xs:element name="restlet-client">
					<xs:complexType>
						<xs:sequence>
							<xs:element name="connector-protocol" type="xs:string" />
							<xs:element ref="connector-parameters" minOccurs="0" maxOccurs="1" />
						</xs:sequence>
					</xs:complexType>
				</xs:element>
			</xs:sequence>
		</xs:complexType>
	</xs:element>

	<xs:element name="connector-parameters">
		<xs:complexType>
			<xs:sequence>
				<xs:element name="parameter" minOccurs="1" maxOccurs="unbounded">
					<xs:complexType>
						<xs:attribute name="name" type="xs:string" use="required" />
						<xs:attribute name="value" type="xs:string" use="required" />
					</xs:complexType>
				</xs:element>
			</xs:sequence>
		</xs:complexType>
	</xs:element>

</xs:schema>
